Round,Player Name,Bid,Value,Plan,Overbid,Underbid,First,risk2,strategy2,understand2
13,Bidder Betty,48.45,57.0,"Strategize primarily bidding 85% of the value. Regularly monitor opponent bidding patterns, adjust my bids to slightly beat the second highest. Occasionally bid lower for unpredictability. Adjust strategy based on results, maximizing profits over numerous rounds rather than each individual auction.",False,True,False,0,1.0,1.0
13,Bidder Charles,6.3,14.0,"Next, test bidding 45-50% for mid-values, 95-99% for high values, and 5-10% for low values. Continuously adapt strategies based on competitor bids. Test sparingly aggressive bids in mid-range to capitalize on potential successes.",False,True,False,1,0.0,1.0
14,Bidder Andy,8.0,16.0,"Test a diverse strategy: incorporate value-close bids, lowball bids around 20-30% of value, and cautious overbidding of 10-15%. Consider competitive trends and data from past results, adjusting bids dynamically. Introduce rare high-risk overbidding situations to explore profit limits.",False,True,False,1,0.0,1.0
14,Bidder Betty,21.6,24.0,"Increase bid to 90% of value occasionally for aggressive play. Navigate to win with minimal overbid. Inject unpredictability with random lower bids. Monitor patterns closely, modifying strategy based on results. Strive for most profit overtime, rather than focusing individual auction win.",False,True,False,1,0.0,1.0
14,Bidder Charles,23.0,46.0,"Next, test bidding aggressively at 90% for high values, 50% for middle values and 10% for low values. Also, experiment with matching the previous round's winning bid to test competitors' adaptability, while observing patterns for dynamic adjustments.",False,True,False,1,0.0,1.0
0,Bidder Andy,63.0,63.0,"Plan to test multiple bidding strategies, including aggressive high bids to gain data on competitors' tendencies, low-range bids to learn behavior when 'outscored', and mid-range bids for balanced insight. Also, I will track bidding patterns and adapt: if competitors bid high, I will explore lower-end; if they bid lower, I'll test high bids. Furthermore, I will experiment with randomized bidding to create uncertainty, and sequential lowering or raising bids by small increments strategy.",False,False,False,1,0.0,1.0
0,Bidder Betty,77.0,77.0,"Initially, I plan to make medium to high bids, in the range of $50 to $99 to gather data on my opponents' strategies. Then, based on the bidding behavior of Andy and Charles, I'll adapt my strategy. If they are consistently bidding low, I'll reduce my bids to slightly above their average for potential profits. If they bid high, I'll selectively bid high when my value is high and bid low otherwise. Periodically, I'll make aggressive high bids for observational purposes. This mix of strategic and aggressive bidding will optimize user profit in the long run.",False,False,False,1,0.0,1.0
0,Bidder Charles,80.0,61.0,"I plan to experiment with a range of bids from high, medium, to low values to gauge competition and assess possible profit margins. I will first start with aggressive high bids for data collection. If unsuccessful or margins are thin, I will transition to conservative low bids, then to moderate bids based on the data and competition pattern. Through progressive learning and adjusting bid strategy, I aim to maximize profit in the long run without risking too much capital in the early stage.",True,False,False,0,0.0,1.0
1,Bidder Andy,46.0,19.0,"I plan to test low and high-end bidding. Specifically, I'll place lower bids in the range of $45-$50, and higher bids around $80-$85. I'll closely observe the bidding patterns of Betty and Charles to adjust my strategy as needed in future rounds.",True,False,False,0,0.0,1.0
1,Bidder Betty,35.0,22.0,"Plan to opt for diverse strategies by trying lower bids, around $30-$45, in a few rounds, along with occasional aggressive high bids on higher valued draws. This variety will allow us to observe any patterns or reactions from Andy and Charles.",True,False,False,1,0.0,1.0
1,Bidder Charles,98.0,2.0,"I propose a sequential strategy. Firstly, bid aggressively high, likely over the value, to monitor other bids. Then bid slightly above half value, gauging middle ground competition. Lastly, test low bids, lower than half our value for understanding bottom line. Adjust strategy based on learnings.",True,False,False,1,0.0,0.0
2,Bidder Andy,75.0,32.0,"I'll test random bidding, within $60-$90, to maximize chances of winning. Also, I'll observe and adapt to the opponents' patterns. If both consistently bid high, I'll test a contrarian low-bidding strategy.",True,False,False,1,0.0,1.0
2,Bidder Betty,88.0,94.0,"I'll move to bid conservatively around $30-$40 for values under $50, place higher bids for values parallel to mine for values over $60, and occasionally, place aggressive bids to observe reactions.",False,True,False,0,0.0,1.0
2,Bidder Charles,4.0,8.0,"In the next few rounds, I'll follow a revised bidding strategy. Starting with conservative low bids, slightly below or equal to half the prize value. Then shifting to moderate bids of around the exact value, thereby adjusting my bids based on observed competitors' behaviours.",False,True,False,0,0.0,1.0
3,Bidder Andy,70.0,7.0,"Next, I'll bid around $60-$80. Create uncertainty through variability, but stay within a strategic range based on competition patterns. Adjust strategy if well-outbid on multiple occasions, and balance experimentation with focusing on increasing total profit.",True,False,False,0,1.0,1.0
3,Bidder Betty,74.0,75.0,"I plan to bid close to my value for high values, bid $30-$40 for low values, and occasionally bid aggressively. I'll also subtract $1 from my usual bid to potentially increase profits. Observing Andy and Charles bids will guide the approach.",False,True,False,1,0.0,1.0
3,Bidder Charles,76.0,76.0,"For the next rounds, I plan to adopt a mid-range bidding strategy, bidding near my value, to test participant risk tolerance. Analyzing bidding patterns, will determine if returning to a more aggressive or shifting to a lower bid strategy is necessary for long-term profitability.",False,False,False,0,1.0,1.0
4,Bidder Andy,51.0,83.0,"For next rounds, I'll shift towards mid-range bids ($40-$60) to mitigate losses. I'll explore gradual increment and sudden decrease strategies to analyze opponents' reactions. I'll continue observing competition patterns, adjusting my bids to maintain competitive edge while minimizing loss.",False,True,False,0,0.0,1.0
4,Bidder Betty,50.0,50.0,"Using prior data, I'll continue diversified bidding. For low values, I'll bid $30-$40. For high values, I will bid in line with value. Scattered high-risk bids will also be included for analytical observation of Andy's and Charles's strategies.",False,False,False,1,0.0,1.0
4,Bidder Charles,12.0,12.0,"Next, I'll apply diverse strategies to gather insights: start bidding moderately within the high-value range, then decrease gradually to gauge competitors' risk tolerance while minimizing potential losses, and finally, employ a more cautious approach, bidding around half value to observe the lowest competitive threshold.",False,False,False,0,0.0,1.0
5,Bidder Andy,44.0,7.0,"I'll experiment with lower bids around $40-$50, anticipating competitors' high bids. Alternatively, mid-to-high value bids will be tested alternately, while observing the bidding patterns. Successfully, variance and uncertainty can be introduced, enabling effective strategy adaptation for profit maximization in long-term.",True,False,False,0,0.0,1.0
5,Bidder Betty,15.0,16.0,"Plan to explore varying bids: low bids for low values, closer bids for high values, and intermittently aggressive bids. Experiment with bidding slightly lower than value to increase profit margins. Continue learning from Andy's and Charles's bidding habits to optimise strategy.",False,True,False,0,0.0,1.0
5,Bidder Charles,76.0,76.0,"Next rounds will experiment bid amount around value to observe competitors' behavior. If unsuccesful, I'll risk aggressive high bids, then resort to very conservative low bids. This varied approach should help understand contest dynamics and develop a long-term profitable strategy.",False,False,False,1,0.0,1.0
6,Bidder Andy,35.0,40.0,"For the next rounds, I intend to explore more unpredictable bidding patterns, leaning towards low bids ($20-$40). Simultaneously, I'll occasionally test sudden high bids, and shift my strategy based on the observed bidding dynamics of Betty and Charles. The goal is long-term profitability through strategy adaptability.",False,True,False,1,0.0,1.0
6,Bidder Betty,48.0,49.0,"In the next rounds, I'll mainly bid my value minus $1 for high value draws, bid around $30-$40 for low values, and sporadically bid aggressively. By doing so, I can gather crucial insights about Andy's and Charles's strategies and adjust my own strategy accordingly.",False,True,False,0,0.0,1.0
6,Bidder Charles,25.0,26.0,"For the upcoming rounds, I plan to adjust my bidding strategy: initially bidding slightly below my value to balance risk and reward, then progressively lowering my bids to explore the lower competition threshold, and finally, reverting to value-based bids grounded on learned patterns.",False,True,False,0,0.0,1.0
7,Bidder Andy,39.0,19.0,"Plan aggressive high bids and sporadic low ones to gather data. Experiment around ranges $30-$40 and $80-$90. Reactively adapt; if opponents bid high, place low bids. If they bid less, choose high bids. Consider randomized bids and small incremental changes for unpredictability benefitting long-term profit.",True,False,False,1,0.0,1.0
7,Bidder Betty,45.0,46.0,"For upcoming rounds: continue bidding $1 below my value for high values, around $30-$40 for low values; occasionally bid aggressively. Tactically underbid on higher values to further increase profit margins and gather data on Andy's and Charles's strategies for future advantage.",False,True,False,0,0.0,1.0
7,Bidder Charles,85.0,82.0,"Test three strategies: 1. Bid aggressive high, slightly above value. 2. Bid modest, around half value. 3. Adopt a conservative strategy, bidding significantly below value. Iterate cycle, modifying as per findings to achieve long-term profitability.",True,False,False,1,0.0,1.0
8,Bidder Andy,33.0,19.0,"In the upcoming rounds, I'll deploy a wide yet unpredictable bidding range between $30-$90. I'll experiment with higher-risk aggressive high bids and conservative low bids to maximize data collection on competition behavior. I'll continue adapting strategies based on observed bidding patterns of Betty and Charles.",True,False,False,1,0.0,1.0
8,Bidder Betty,44.0,45.0,"My plan is to continue with diverse strategies. For high value draws, I'll bid just below the value. For low values, I will bid around $30-$40. Occasionally, I'll place aggressive bids to gather data and observe reactions from Andy and Charles.",False,True,False,0,0.0,1.0
8,Bidder Charles,83.0,83.0,"Plan: To start, bid aggressively over value. Then, bid modest, around half the value. Finally, employ conservative low bids. Iterate this cycle and modify based on findings, aiming for profitable long-term results.",False,False,False,1,0.0,0.0
9,Bidder Andy,75.0,83.0,"Plan to place high-risk aggressive bids ($70-$90) and alternate with conservative lower bids ($30-$50) to gather data. Emphasize unpredictability, adapt in real time based on Betty's and Charles's bidding patterns to maximize long-term profit.",False,True,False,1,0.0,1.0
9,Bidder Betty,92.0,93.0,"Plan to bid $1 less on high values, $30-$40 on low values, and sporadically, bid aggressively for data gathering. Continue underbidding on higher values to optimize profit while observing Andy and Charles' strategies.",False,True,False,0,0.0,1.0
9,Bidder Charles,89.0,79.0,"Proceed with a mix of strategies: initially bid above value to test upper competitiveness, follow with moderate bids around half value, finish cycling with a conservative strategy, bidding significantly below value. Adjust the sequence based on competitors' behavior for a long-term profitable approach.",True,False,False,1,0.0,0.0
10,Bidder Andy,90.0,32.0,"Next, I'll explore high-risk bids in the range of $90-$99 to challenge the current high bidders, along with occasional conservative bids around $50-$60 for diversity and unpredictability. I will continue to monitor competitors' patterns for strategy adjustment.",True,False,False,1,1.0,1.0
10,Bidder Betty,35.0,36.0,"Plan to stay flexible; bid $1 less on high values, $30-$40 on low, and occasional aggressive bids. Monitor trends and responses from Andy and Charles to optimize profit. Experiment with bidding slightly more below value on high-valued draws to enhance winnings.",False,True,False,1,0.0,1.0
10,Bidder Charles,66.0,66.0,"Plan: I'll adopt an experimental bidding strategy. To start, bid around prize value, then bid significantly above value to test upper limit. Next, bid just below half value, finally bid very low. Adjust and repeat cycle based on profit outcomes and reaction of other bidders.",False,False,False,1,0.0,0.0
11,Bidder Andy,66.0,78.0,"Continue a varied bidding strategy, focusing on $40-$70 range. Introduce unpredictability by occasional high-risk bids ($90-$99), and observe responses. Gradually reduce bid amount when my value is low, mitigating losses. Continuously adapt to Betty and Charles's patterns for long-term profit optimization.",False,True,False,1,1.0,1.0
11,Bidder Betty,78.0,79.0,"Plan: Maintain bid $1 below value for high draws, bid $30-$40 for low. Occasionally bid above value for data. Incorporate flexible underbidding based on previous round results. Consistently monitor competitors' trends to improve strategy, maximize profits.",False,True,False,0,0.0,1.0
11,Bidder Charles,45.0,73.0,"Continue the experimental approach: Bid initially above the value to assess upper limit, follow with moderate bidding around half value or less, then cautiously bid significantly below value. Revise approach based on reward-risk assessment, competitor pattern, and previously observed profitable ranges.",False,True,False,0,0.0,1.0
12,Bidder Andy,35.0,30.0,"Will test varying the bid in measures of $5-$10 around my value. Similar low-risk approaches will be tested alternately with random high-risk bids ($85-$99), observing reactions. Adaptability remains crucial for long-term profit maximization.",True,False,False,1,0.0,1.0
12,Bidder Betty,11.0,12.0,"Strategy: Continue $1 below value for high draws, $30-$40 for low, occasionally bid aggressively to gather data. Try slightly larger underbids on high-value draws to maximize profit. Consistently observe Andy and Charles for effective adjustments.",False,True,False,0,0.0,1.0
12,Bidder Charles,0.0,0.0,"Next plan: Cycle between aggressive, moderate, and conservative bids to test limits. Start with a high bid slightly beyond value, then bid around half value, and finally attempt significantly lower bids. Strategically adjust based on observed patterns for profitable outcomes.",False,False,False,1,0.0,1.0
13,Bidder Andy,75.0,68.0,"In the next rounds, I'll try a strategy of bidding around my value plus some increment ranging from $5-$15. Additionally, I'll test occasional strategic high bids near $90-$99, gauging Betty's and Charles's reactions. This varied approach aims at preserving unpredictability while pursuing profit maximization.",True,False,False,1,0.0,1.0
13,Bidder Betty,56.0,57.0,"Adapting strategies: For high draws, I'll bid $1 beneath value. For low draws, (around 30-40) I plan to bid $20-35 occasionally, test higher aggressive bids to observe results. Constant observation and adaptation of Andy and Charles strategies for strategic adjustments and long-term profit optimization.",False,True,False,1,0.0,1.0
13,Bidder Charles,14.0,14.0,"Moving forward, I'll start with conservative bids, follow with moderate bids around value, then experiment with aggressive overbids. I'll adjust strategy based on competitive analysis, risk-reward balance, and trends, aiming to progressively learn and increase profit margin.",False,False,False,0,0.0,1.0
14,Bidder Andy,20.0,16.0,"I'll use a tiered bidding strategy next. For values below $30, I'll bid $20-$40. For values $30-$70, I'll bid within $50-$80. For values above $70, I'll bid $80-$99. Consistent unpredictability and adaption based on Betty's and Charles's behaviours will be my focus.",True,False,False,1,0.0,0.0
14,Bidder Betty,23.0,24.0,"I'll continue executing diverse strategies: bid $1 below my value for high values, around $30-$40 for low values, and occasionally high bid to gather data. I will experiment with larger underbids and persistently observe Andy and Charles' trends for strategic adjustments.",False,True,False,0,0.0,1.0
14,Bidder Charles,70.0,46.0,"Plan: Start with aggressive overbidding, move to bids slightly below value, and finally test conservative low bids. Modify based on observed patterns, risk assessment, and long-term profitability. This should provide a comprehensive insight into the auction dynamics.",True,False,False,1,0.0,1.0
0,Bidder Andy,32.0,32.0,"Plan to test multiple bidding strategies, including aggressive high bids to gain data on competitors' tendencies, low-range bids to learn behavior when 'outscored', and mid-range bids for balanced insight. Also, I will track bidding patterns and adapt: if competitors bid high, I will explore lower-end; if they bid lower, I'll test high bids. Furthermore, I will experiment with randomized bidding to create uncertainty, and sequential lowering or raising bids by small increments strategy.",False,False,False,1,0.0,1.0
0,Bidder Betty,80.0,90.0,"Initially, I plan to make medium to high bids, in the range of $50 to $99 to gather data on my opponents' strategies. Then, based on the bidding behavior of Andy and Charles, I'll adapt my strategy. If they are consistently bidding low, I'll reduce my bids to slightly above their average for potential profits. If they bid high, I'll selectively bid high when my value is high and bid low otherwise. Periodically, I'll make aggressive high bids for observational purposes. This mix of strategic and aggressive bidding will optimize user profit in the long run.",False,True,False,1,0.0,1.0
0,Bidder Charles,70.0,51.0,"I plan to experiment with a range of bids from high, medium, to low values to gauge competition and assess possible profit margins. I will first start with aggressive high bids for data collection. If unsuccessful or margins are thin, I will transition to conservative low bids, then to moderate bids based on the data and competition pattern. Through progressive learning and adjusting bid strategy, I aim to maximize profit in the long run without risking too much capital in the early stage.",True,False,False,0,0.0,1.0
1,Bidder Andy,42.0,31.0,"Plan to test aggressive bids, low-range bids, and mid-range bids. Keeping an eye on bidding tendencies, adapt accordingly. Randomize bidding to create unpredictability. Consider increasing bids if my value is close to $99 or competition bids high persistently.",True,False,False,1,0.0,1.0
1,Bidder Betty,15.0,21.0,"Next, I'll conduct strategic bidding. If my value is high ($70-$99), I'll bid high to increase winning chances. If it's moderate ($30-$69), I'll bid slightly above opponents' average. For low values ($0-$29), I'll bid low to minimize losses. Occasionally, I'll aggressively bid high for data collection.",False,True,False,0,0.0,1.0
1,Bidder Charles,79.0,70.0,"Based on the previous round, I plan to adjust my bidding strategy, starting with an aggressive high bid. Observing competing bids will further inform my strategy. Fluctuating between high, medium, and low bids will allow for risk assessment and potential profit maximization.",True,False,False,1,0.0,1.0
2,Bidder Andy,92.0,92.0,"Explore a mix of conservative, aggressive, and randomized bidding. Observe patterns and adjust to low/high bids by competitors. Attempt sequential lowering or raising bids in small increments. Utilize high bids if the value is close to $99, irrespective of the competition.",False,False,False,1,0.0,1.0
2,Bidder Betty,5.0,24.0,"I'll continue to bid aggressively ($60-$99) for high values, moderately for mid values ($30-$59), and low for low values ($0-$29). I'll observe their bidding pattern closely to fine-tune my strategy and increase chances of winning while maximizing profits.",False,True,False,1,0.0,1.0
2,Bidder Charles,47.0,48.0,"Considering the analysis of previous rounds, I aim to adopt a flexible and dynamic bidding strategy. I'll bid around 5-10% higher than the second highest bid of the previous round to balance risk and potential profit, while remaining alert to competition changes.",False,True,False,0,0.0,1.0
3,Bidder Andy,3.0,4.0,"Considering earlier bids, I plan to bid slightly below my value if others bid significantly lower. For high-value items, I will still prefer aggressive bids. Additionally, I plan to bring in some unpredictability by incorporating random variations in my bids.",False,True,False,1,0.0,1.0
3,Bidder Betty,10.0,28.0,"I'll make higher bids (60-99) for values above 70, mid-level bids (30-59) for values 30-70, and low bids (0-29) for low values. Larger bids will test if aggressive tactics can intimidate other bidders to optimize long-term profits.",False,True,False,1,0.0,1.0
3,Bidder Charles,20.0,27.0,"Plan to adopt a bid scaling from my value. I'll try bidding around 75% of my valuation. And, progressively adjust this rate based on the outcomes, aiming at balancing risk while attempting to win with good profit margin.",False,True,False,0,0.0,1.0
4,Bidder Andy,35.0,34.0,"Plan to employ responsive bidding: if competitors consistently bid high, take risks with higher bids on higher-value prizes. For low-value prizes, consider underbidding. Incorporate intermittent randomized bidding for unpredictability. Monitor patterns and adjust strategy to maximize overall profit.",True,False,False,1,1.0,1.0
4,Bidder Betty,45.0,60.0,"I'll experiment with marginally higher bids for values below $30 to test their impact. For values $30-$69, I'll place bids just above opponents' average. If value exceeds $70, I'll bid high occasionally to assess opponents' reactions, aiming to increase long-term profit maximization.",False,True,False,0,0.0,1.0
4,Bidder Charles,33.0,31.0,"I'll implement a dynamic strategy, gauging other bids as baselines. Starting slightly above my value, if unsuccessful, I'll adjust to slightly below. I aim to balance risk and profit by flexibly adapting my bid around the second highest value from previous rounds, reading competition pattern.",True,False,False,0,0.0,1.0
5,Bidder Andy,33.0,35.0,"Strategy: Employ high bids for high values, moderate for middling values, and underbid for low values. Random variations to create unpredictability. Adapt bids based on competitor patterns. Also, when outbidding doesn't seem feasible, explore minimizing losses by bidding significantly lower than my value.",False,True,False,0,0.0,1.0
5,Bidder Betty,86.0,84.0,"Plan to balance strategic and exploratory bidding. For values $0-$30, place marginally higher bids for data. Differentiate mid-range value bids ($30-$69) based on opponents' past bidding. Occasional high bids for values $70-$99 to probe opponents' reactions. Readjust strategies as per the data collected continuously.",True,False,False,0,0.0,1.0
5,Bidder Charles,28.0,28.0,"Next, I'll adopt a hybrid approach, toggling between aggressive and conservative bidding. If my value is high, I'll bid slightly above to secure a win. If my value is low, I'll bid conservatively to minimize loss while gathering data on competitors' tendencies.",False,False,False,0,0.0,1.0
6,Bidder Andy,71.0,71.0,"Plan: Continue aggressive and exploratory bidding for high values. For low values, further reduce bid ratio and introduce random fluctuations. Observe competitors and adapt strategies, balancing risks and returns. Remain unpredictable when necessary, incorporating diverse bidding strategies.",False,False,False,1,0.0,1.0
6,Bidder Betty,22.0,17.0,"In the upcoming rounds, I'll implement a nuanced approach. For low values (0-30), I'll bid slightly high to gauge opponents' reactions. For mid-range (30-70), I'll bid above their average. For high values (70-99), I'll sporadically place high bids to intimidate competitors and optimize long-term profits.",True,False,False,1,0.0,1.0
6,Bidder Charles,33.0,44.0,"In future rounds, I will test a proportion-based strategy, placing bids ranging from 50% to 75% of my given value, adapt to competition data, and progressively increase bid for values above 70, to minimize losses while sustaining profits optimally.",False,True,False,0,0.0,1.0
7,Bidder Andy,58.0,94.0,"Plan: Aim for a value slightly above past second-highest bids. Continue unpredictable bidding and explore a wider bid range, lower or above my drawn value based on competitors' behaviors. Incrementally adjust bids, emphasize on data-driven decision making while balancing risk and return.",False,True,False,1,0.0,1.0
7,Bidder Betty,50.0,46.0,"Next, I will balance strategic and random bidding. For low values ($0-$30), slight high-bids to test opponents' reactions. Set bid slightly above average for middle values($30-$70). High bids for high values ($70-$99) will be deployed occasionally to assert dominance and gather data.",True,False,False,1,0.0,1.0
7,Bidder Charles,44.0,44.0,"My strategy involves varying bid amounts based on my value. For low values, I'll place conservative bids to avoid losses. For high values, I'll bid aggressively to try and secure a win. Additionally, I will reference the second-highest bids from previous rounds to make informed decisions.",False,False,False,0,0.0,1.0
