Round,Player Name,Bid,Value,Plan,Overbid,Underbid,First,risk2,strategy2,understand2
6,Bidder Betty,24.0,25.0,"Continue bidding under value: $1 less for values <35, $2 less for 35-60$. For >60, opt for a $10 difference. Experiment matching highest bid from last round during 40-60$ value. Adjust strategies based on gained knowledge from previous rounds and competitors' patterns.",False,True,True,0,0.0,1.0
6,Bidder Charles,73.8,82.0,"Continuing to test tactics, shifting to aggressive bidding at 90% value for high-valued items and maintaining lower bids for items under $30 to gather more data about competition, then fine-tunning my strategy based on outcomes for maximizing long-term profit.",False,True,True,1,0.0,1.0
7,Bidder Andy,20.0,20.0,"I aim to diversify my approach: bidding close to my value when it's high, varying my bid within mid-ranges when the value is low. Also, I'll examine initiating high risk bids for data collection, while assessing their impact on the total profit.",False,False,True,1,0.0,1.0
7,Bidder Betty,24.0,25.0,"Maintain current bidding strategy: bid $1 less for values <35, $2 less for 35-60$, $5 less if >60$. Start matching highest previous round bid when values lie in 40-60$ range. Adjust based on competitors' patterns, always prioritizing profit maximization over wins.",False,True,True,0,0.0,1.0
7,Bidder Charles,28.7,41.0,"In subsequent rounds, I'll bid 85% of the value for items above $60, 70% for items $30-$60, and 50% for items under $30 to balance exploration and profit maximization. I'll learn from this data for refinement, and progressively adjust bids based on previous observations of competitors.",False,True,True,0,0.0,1.0
8,Bidder Andy,90.0,93.0,"Next, I aim to adjust bid by moving $1-$2 above my previous bid when the price is high and varying my bid by $1-$2 underneath previous bid when the price is low. I'll also explore very high risk bids for data collection, and analyze their impact on overall profit.",False,True,True,1,0.0,1.0
8,Bidder Betty,0.0,1.0,"Next strategy: For values <30 bid $1 less, 30-50 bid $2 less. Increase risk: Values of 50-70, match last highest bid. For >70, bid $3 lower. Spot competitive patterns and adapt.",False,True,True,0,0.0,1.0
8,Bidder Charles,38.5,55.0,"Next, I'll bid 80% value for items above $60, 70% for $30-$60, and 40% for below $30. This balances risk and learning. I'll also submit a low bid on a high-value item to observe reactions. Results will continually refine my strategy for long-term profit maximization.",False,True,True,0,0.0,1.0
9,Bidder Andy,40.0,96.0,"Plan: Adopt a varied strategy - bid close to previous winning bid if value is high, else bid low. Monitor aggressive high and low bids for data analysis. Gradually tweak bid, based on other bidders' behavior and historical profitable bids for maximum returns.",False,True,True,0,0.0,1.0
9,Bidder Betty,68.0,68.0,"Continue bidding below value for values <35, $1/$2 less for higher ranges. For 50-70, match last highest bid. >70, bid $3 less. Depending on competitors' patterns, adjust the gap but maintain focus on profit maximisation.",False,False,True,0,0.0,1.0
9,Bidder Charles,45.6,57.0,"I'll iterate my strategy: bid aggressively (80-90% of value) on high-value items, conservatively (40-70%) on mid-range items. For low-value items, unorthodoxly high bids will be placed to gather competitor response data, adjusting bids based on round outcomes for long-term profit maximization.",False,True,True,1,0.0,1.0
10,Bidder Andy,70.0,46.0,"To increase my profit, I'll adopt a more aggressive strategy, especially when my value is high. I plan to bid just over the highest winning bid from previous rounds whilst considering my assigned value for each round. This data-driven approach should optimize my chances of winning and profitability.",True,False,True,1,1.0,1.0
10,Bidder Betty,75.0,78.0,"Next strategy: bid $1 less for values <30, $2 less for 30-50. For 50-70 values, try matching last highest bid. For values >70, test bidding $3 less. Continue adjusting strategies based on competitors' patterns and profit outcomes.",False,True,True,0,0.0,1.0
10,Bidder Charles,80.0,33.0,"For subsequent rounds, I'll adjust strategy to bid 85% value on items above $70, 65% for value between $40-$70, and high bid of $80 on items under $40 to gather high-risk data, fine-tuning strategies based on outcomes for profit maximization.",True,False,True,1,0.0,1.0
11,Bidder Andy,28.0,36.0,"Next, I'll test a scaled bidding strategy, basing bids on a percentage of my value. Also, I'll experiment with bidding just below the highest past winning bid to compete closely without incurring high risk. Continuous monitoring of past rounds will guide bid adjustment.",False,True,True,0,0.0,1.0
11,Bidder Betty,44.0,46.0,"Plan to test aggressive strategy for values over $70, bidding identical to value. For mid-range values (35-70), maintain $2 lower bid; for lower values (<35), maintain $1 lower. Continual review and adjustment based on other bidders' behavior for long-term profit maximization.",False,True,True,1,0.0,1.0
11,Bidder Charles,72.0,80.0,"Next strategy: aggressive bidding 90% of value for above $70, and a conservative 60% for $40-$70 range. For under $40 items, I'll bid high ($70-$80) to gather data, optimizing strategy based on ongoing round outcomes for the ultimate aim of long-term profit maximization.",False,True,True,1,0.0,1.0
12,Bidder Andy,35.0,35.0,"Experimenting with a tiered strategy, I'll bid high if my value exceeds 70, moderately if between 50 and 70, reasonably low if between 30 and 50, and minimum otherwise. I'll also consider closer-to-value bids for data diversity. This hybrid approach is aimed at maximizing long-term profitability.",False,False,True,0,0.0,1.0
12,Bidder Betty,76.0,76.0,"Continue testing underbidding strategy. Bid $1 less for value <35, $2 less for 35-69. For value >70, try the risky strategy of bidding identical to value. Adjust based on competitor patterns and keep long-term profit as priority.",False,False,True,1,0.0,1.0
12,Bidder Charles,26.0,40.0,"Adapting my approach; bidding 90% of the value for above $70 items, 65% for items between $40-$70, and sensitive high-risk bids for items below $40 to track opponents' reactions to unusual bidding patterns. Adjusting strategy accordingly for profit optimization in response to round analysis.",False,True,True,1,1.0,1.0
13,Bidder Andy,10.0,23.0,"I plan to experiment with a mix of caution and competitiveness. When the value is low, I'll bid low. If the value is high or mid-range, I'll bid closer to the average of all previous winning bids, aiming to balance profit margin and winning likelihood.",False,True,True,0,0.0,1.0
13,Bidder Betty,92.0,97.0,"Plan to bid under value: $1 less for < $35, $3 less for $35-70. In high-value rounds (>70), bid $5 below. Monitor other bidders' behavior and strategize accordingly for higher bids, considering previous winning bids. Profit maximization remains the priority.",False,True,True,0,0.0,1.0
13,Bidder Charles,40.0,56.0,Plan: Aggressively bid 90% value for items over $70; bid between 60-70% for $40-$70 range. Low-value items will witness high-risk bids. Adjust strategy based on bid outcomes and competitors' behaviors for profit maximization and data gathering purposes.,False,True,True,1,0.0,1.0
14,Bidder Andy,3.0,7.0,"Plan: Implement a cautious yet competitive bidding. When my value is lower, I will bid a low amount. However, for high or intermediate values, my bids will approach halfway between my value and average of previous winning bids, trying to optimize profitability and winning probability.",False,True,True,0,0.0,1.0
14,Bidder Betty,21.0,22.0,"Next plan: For values <35, bid $1 less; for 35-70, bid $3 less. For >70, bid $52 less than value. Analyze changes in opponents' strategies, adapt accordingly, and prioritize profit maximization over winning.",False,True,True,0,0.0,1.0
14,Bidder Charles,70.0,32.0,"Moving forward, I'll bid 90% value on items >$70, 70% for $40-$70 range, and apply high-risk strategies (>$70 bids) with low-valued items (<$40) to gain understanding on bidder reactions, refining strategy progressively for profit maximization.",True,False,True,1,0.0,1.0
0,Bidder Andy,40.0,86.0,"Initially, I'll place small to medium bids ($20-$50) to gauge competitors' tendencies. Then, I'd shift to more aggressive bidding ($70-$99) to test higher returns, understanding the risk involved. Following this, I'll employ a dynamical approach, adjusting bids based on my value and previous round data. If I observe a consistent bidding pattern in Betty and Charles, I'll use that information to strategically place my bids. Towards the end, I'll choose between aggressive or conservative strategies based on overall profit performance.",False,True,True,1,1.0,1.0
0,Bidder Betty,81.0,81.0,"In order to maximize the user's profit, I plan on trying two strategies: Aggressive bidding and Conservative bidding. In Aggressive, I'll bid close to my own value if it's above the median of $49 to gather data. In Conservative, I'll bid lower, around half of my value, to create a safety net for rounds with high uncertainty. These strategies will be applied alternately and then assessed based on the profit outcomes, further refining the choice of strategy based on historical data.",False,False,True,0,0.0,1.0
0,Bidder Charles,1.0,5.0,"I'll start by bidding low (10-20% of my value) in initial rounds to observe other bidders' behavior. Then, I'll experiment with moderate (40-60% of value) and high-range (70-90% of value) bids. If I notice either Andy or Betty consistently bidding higher, I'll implement a rational strategy and bid slightly higher. If results fluctuate, I'll alternate between aggressive (high bids) and conservative (low bids) strategies to balance risk and profit. Considering previous rounds and their outcomes will aid in refining my strategy.",False,True,True,1,0.0,1.0
1,Bidder Andy,92.0,97.0,"Next, I plan to test aggressive but calculated strategies. If my value is high (>$70), I'll bid close to the actual value, taking a risk. With a middle value range, I'll stick to bidding half. For low value items, I'll bid less to minimize any potential loss.",False,True,True,1,1.0,1.0
1,Bidder Betty,59.0,61.0,"Next, I intend to keep my strategies varied between Conservative and Aggressive. If this round’s value is high, I will bid aggressively, just below my actual value, to dominate and note the result. If it's low, I'll bid conservatively, less than half, to cut losses and gain insights.",False,True,True,1,0.0,1.0
1,Bidder Charles,14.0,47.0,"Next, I'll bid 30% of my assigned value, to test moderate bidding. If not successful, I'll switch to a high bid, risking a loss for data. Observations from these trials will refine my future bidding strategy for maximizing long-term profit.",False,True,True,1,0.0,1.0
2,Bidder Andy,22.0,44.0,"For the next round, I plan to adopt varying bidding strategies. If my value is low (<$30), I'll bid $1 to minimize losses. For a middle range value, I'll bid half my value. For high (>70) values, I'll bid 10% less than the full value to maximize profit.",False,True,True,0,0.0,0.0
2,Bidder Betty,50.0,56.0,"Next, I will apply a Moderately Aggressive strategy. If my value is high (above $50), I'll bid 90% of it. If it's low, I'll bid a third. This strategy strikes a balance and aids further data collection.",False,True,True,1,0.0,1.0
2,Bidder Charles,34.0,48.0,"I'll increase my bid to 60-70% of my value to evaluate a more aggressive approach, observing Andy and Betty's reactions. If unsuccessful, I'll adjust, alternating between high-risk and moderate bids for strategic balance and profit maximization.",False,True,True,1,0.0,1.0
3,Bidder Andy,30.0,41.0,"Next, I'll raise my middle range bids ($30-$60 values) slightly to test competitiveness. For high values, I'll continue aggressive bidding. For low values, I'll aim to minimize loss with $1 bids. Further, I'll observe Betty and Charles' tendencies for future strategic bidding.",False,True,True,1,0.0,1.0
3,Bidder Betty,22.0,44.0,"Adapting from previous results, I'll adopt a sliding scale approach. For values under $30, bid 30%. If value is between $30 and $60, bid 50%. And for values above $60, bid 80%. This balances risk and reward, providing more data on outcomes across the value spectrum.",False,True,True,0,0.0,1.0
3,Bidder Charles,65.6,82.0,"I'll bid 80% of my value in next round as an aggressive strategy. Afterwards, bid alternation between 40% and 75% will be performed to test reactions and adjust for profit maximization.",False,True,True,1,0.0,1.0
4,Bidder Andy,46.0,41.0,"Moving forward, I'll increase middle range bids slightly, continue aggressive bids for high values, strive to minimize loss for low values with $1 bids, and observe Betty and Charles to make informed bid decisions.",True,False,True,0,0.0,1.0
4,Bidder Betty,0.4,1.0,"I will test two strategies, 'Scaled Aggressive' where I bid 90% when my value is above $70, and 'Cautious' where I bid 40% when it's below $30. For values in-between, I bid 60%. This offers a balanced risk-reward scenario for better analysis.",False,True,True,0,0.0,1.0
4,Bidder Charles,33.0,55.0,"I'll bid between 40% and 60% of my value for the first two trials. Then, I'll increase to 70-80% in bid three for a high-risk test, followed by 50% in the fourth round for risk moderation. Ongoing strategy will depend on outcomes and opponents' behavior.",False,True,True,0,0.0,1.0
5,Bidder Andy,60.0,67.0,"For the next rounds, I'll bid 10% less than my value for high values. I'll increase my bid to 60% of my value for middle range values and maintain a $1 bid strategy for low values.",False,True,True,0,0.0,1.0
5,Bidder Betty,72.9,81.0,"Planning to test 'Scaled Risk' strategy: Bid 90% for values above $80, 50% for values between $40 and $80, and 20% for values below $40. Aims for balanced risk and rewards, aiding comprehensive data collection for future bidding strategy adjustments.",False,True,True,0,0.0,1.0
5,Bidder Charles,21.0,42.0,I'll pursue a dual strategy - bidding aggressively (70-90% of value) if prior value is high and conservatively (30-50%) when it's low. This aims at risk distribution while observing variation in rivals' actions for strategic modification for profit maximization.,False,True,True,1,0.0,1.0
6,Bidder Andy,33.0,47.0,"I will closely watch competitors' bidding pattern. Based on my current value, I'll bid 90% for high values. I'll increase middle range bids from 60 to 70% of value. Low value bid will consistently be $1 to prevent losses, gathering more data for better informed decisions.",False,True,True,0,1.0,1.0
6,Bidder Betty,77.6,97.0,"Coming rounds, I'll implement 'Scaled Risk Adaption': Bid 80% for values above $70, 40% for values between $40 and $70, and 20% for below $40. Aims to balance risk and reward, adjusting according to previous round insights for better bid positioning and increased profits.",False,True,True,0,0.0,1.0
6,Bidder Charles,13.0,26.0,"Considering variables of profitability and risk, I'm planning to bid 50% of value during next rounds. If unsuccessful, I'll implement a high bid, approximately 80% of value, to challenge Andy and Betty, readjusting my strategy based on their reactions and the profit outcomes.",False,True,True,1,0.0,1.0
7,Bidder Andy,1.0,27.0,"Plan: Analyze competitors' bids. For high values (>$70), bid near the value minus $10 for a bigger profit margin. On middle-range values, bid exactly 60% of the value. For low values (<$30), keep the bid to $1 to limit losses.",False,True,True,0,0.0,0.0
7,Bidder Betty,58.8,84.0,"Implementing 'Adaptive Sliding Scale': Bid 70% for values above $80, 40% between $40-$80, 10% below $40. Adjusts risk according to value, optimizing profit margins. Further data analysis refines bid optimization in the adjusted scale range for improved winning probabilities and heightened profit potential in the broader strategy context.",False,True,True,0,0.0,1.0
7,Bidder Charles,6.0,14.0,"I plan to adopt a dynamic bid strategy - 30-40% for low values and 70-90% for high values. If unsuccessful, I'll switch to consistent high bidding for a few rounds to upset the auction equilibrium and gather more data.",False,True,True,1,0.0,1.0
8,Bidder Andy,1.0,1.0,"Plan: Apply aggressive bidding for high values (>70), bidding near my value. Adopt moderate bidding for middle values, around 65% of my value. Maintain minimum ($1) bids for low values (<30) to limit losses. Study other bidders' patterns to enhance strategic decisions.",False,False,True,1,0.0,1.0
8,Bidder Betty,1.95,13.0,"Retain the 'Adaptive Sliding Scale' bidding strategy, optimize the scales based on data analysis; 65% for values >$80, 35% between $40-$80, and 15% <$40. The modifications aim at refining the balance between risk and reward based on previous round observations.",False,True,True,0,1.0,1.0
8,Bidder Charles,48.5,97.0,"Next, I'll bid exactly 50% of my value for two rounds. Afterward, I'll shift to high bidding (80% of value) for high risk yet potentially high reward, adapting based on observations of Andy and Betty's behavior.",False,True,True,1,0.0,1.0
9,Bidder Andy,36.0,56.0,"Plan: Continue aggressive bids for high values (>70), bid near my value. Maintain 65% of my value for medium bids. Keep $1 bids for low values (<30). Accumulate data on opponents' strategies for strategic adjustments.",False,True,True,1,0.0,1.0
9,Bidder Betty,51.6,86.0,"Maintain an 'Adjusted Sliding Scale' strategy; bid 60% for values >$80, 30% for $40-$80, 20% for <$40. This fine-tuned approach evenly balances risk and rewards, informed by previous round outcomes.",False,True,True,0,0.0,1.0
9,Bidder Charles,2.0,6.0,"I'll deploy a responsive strategy, bidding 60% of my value for high values (70-99) and stay at 30-40% for lower ones (below 70). Based on rivals' moves, I may shift towards more aggressive bidding. A periodic return to 50% bidding can provide useful insights for future rounds.",False,True,True,0,0.0,1.0
10,Bidder Andy,79.0,88.0,"For high values, I'll bid 90% of the value. With middle values, I shall increase my bid to 70% of the value. For low values, I'll stick to a $1 bid. I'll analyze opponents' patterns for strategic decisions.",False,True,True,0,0.0,1.0
10,Bidder Betty,1.0,7.0,"Applying 'Strategically Optimized Scale': bid 55% for values >$80 to safeguard profit, 30% for $40-$80 to manage moderate risk, 15% for <$40 to minimize loss in unfavorable scenarios. This data-driven strategy caters to maximized profit potential while adeptly managing risk parameters in the bidding landscape.",False,True,True,0,1.0,1.0
10,Bidder Charles,7.0,19.0,"I plan to try range bidding next - 30-40% of my value for lower values (0-49), and 60-75% for higher values (50-99). I'll also conduct periodic risky high bids (80-90%) to test strategies and gather data.",False,True,True,1,0.0,1.0
11,Bidder Andy,44.0,58.0,"I plan to continue aggressive bidding for high values (>70) near my value. For middle values, I'll increase bids to 75% of my value. And if the value is low (<30), I'll bid $1. Constantly, I'll adapt my strategy based on competitors' tendencies.",False,True,True,1,0.0,1.0
11,Bidder Betty,11.0,56.0,"In the next rounds, my strategy will be an 'Adaptive Bid Percentage': bid 50% if value >$80, 20% for $40-$80, and 10% <$40. It's designed to cautiously optimize profit and limit losses, while continually adapting based on previous auction outcomes.",False,True,True,0,0.0,1.0
11,Bidder Charles,1.0,3.0,"I'll experiment with responsive bidding, adjusting by 10% increments within a chosen range (30-40% for values 0-50, 60-80% for values 51-100). Intermittently, I'll bid aggressively (80-100%) to potentially boost profit while challenging Andy and Betty's strategies.",False,True,True,1,0.0,1.0
12,Bidder Andy,30.0,38.0,"For high values (>70), I'll bid just above competitors' highest past bids (+$1). For middle values (30-70), I'll bid around 78% of my value. With low values (<30), I'll maintain $1 bids. Constantly observing prior bids to adjust strategies.",False,True,True,0,1.0,1.0
12,Bidder Betty,41.0,92.0,"Implementing 'Dynamic Bid Layering': bid 45% for high values >$80 securing major profit, 25% for values $40-$80 mitigating moderate risk, 10% for low values <$40 minimizing potential losses. It balances profit optimization with minimal risk expansion, adapting to the auction environment by continual learning from past outcomes.",False,True,True,0,1.0,1.0
12,Bidder Charles,6.0,13.0,"I'll implement a dual strategy next - bidding 30-50% for low values (0-49), and 70-90% for higher values (50-99). Periodically, I'll shift to 80-100% bids, allowing for high-risk, potential high-reward scenarios, while observing opponents' reactions.",False,True,True,1,0.0,1.0
13,Bidder Andy,90.0,95.0,"Next, I'll bid 95% of the value for high values (>70), 80% for middle values (30-70), and $1 for low values (<30). I'll also fine-tune strategies based on competitors' recent bids.",False,True,True,0,0.0,1.0
13,Bidder Betty,8.0,40.0,"Leveraging 'Apex Predatory Bidding': bid 40% if high values >$80, 20% for $40-$80, and 5% for <$40. Focused on tightly managed risk-to-reward ratio, it effectively streamlines profit optimization while learning from past outcomes to adapt and strengthen the bidding strategy.",False,True,True,0,1.0,1.0
13,Bidder Charles,66.0,73.0,"Next, I'll implement varying strategies based on my value - bid 30-50% for low values and 70-90% for high ones. On occasion, I'll employ aggressive bidding, hitting 90-100% of my value to analyze its impact on long-term profits and opponent reaction.",False,True,True,1,0.0,1.0
14,Bidder Andy,36.55,43.0,"I'll execute hit-and-run tactic for high values (>70), bidding just above the last round's highest bid to ensure a win. For middle values (30-70), I'll bid 85% of my value to increase competitiveness. I'll retain $1 bidding for low values (<30).",False,True,True,1,1.0,1.0
14,Bidder Betty,1.5,30.0,"Maintaining 'Progressive Incremental Bidding': bid 35% for high values >$80 to optimize profit, 20% for moderate values $40-$80 to control risk, 5% for low values <$40 to reduce losses. This method delicately balances profit and risk while providing insights for strategic adaptations based on past rounds.",False,True,True,0,0.0,1.0
14,Bidder Charles,58.0,84.0,"Next, I'll bid around 50% for values 0-49 and 70-90% for values 50-99. Intermittently, I'll make high-risk bids of 90-100% to gather strategy data, while observing Andy and Betty's reactions for potential adjustments.",False,True,True,1,0.0,1.0
0,Bidder Andy,36.5,73.0,"I plan to first bid conservatively by bidding half of the value I see for the prize. After observing Betty and Charles' patterns, I might re-strategize and bid at different fractions or place slightly higher bids. I will also venture into more aggressive bids, investing most of the value when I predict the prize value might be high for others, too. If bidding higher does not pay off, I'll then favor moderate bids to balance profits. Furthermore, from their loss or low profit rounds, I'll learn to avoid their unsuccessful bidding amounts.",False,True,True,0,0.0,1.0
0,Bidder Betty,57.0,60.0,"Plan to test a few bidding strategies next: 1) Slightly below value strategy: Bid close to my value but slightly lower, to win often while maintaining a decent profit margin. 2) Constant bid strategy: Always bid a flat amount, say $50 to gather data on its efficiency. 3) High-risk, high-reward strategy: Occasionally, place a high bid well above my value, to explore outlier chances of a win with a big payoff. With these strategies, I aim to review past rounds to find a pattern and establish the best approach to maximize long-term profit.",False,True,True,1,0.0,1.0
0,Bidder Charles,42.0,84.0,"Plan to test various strategies. Start with safe bids, around 50% of the value. Then test aggressive bids close to full value. Follow with risky bids over value to understand competition behavior. Monitor competition bidding patterns to adjust strategy. Lastly, experiment with random bids for data variation. Iterate strategies based on past round learnings to maximize profit.",False,True,True,1,0.0,1.0
1,Bidder Andy,16.0,24.0,"I plan to test higher bidding strategies, around two-thirds of the prize value to foster winning chances. Additionally, if my prize value is extremely high, I will bid aggressively for data-gathering.",False,True,True,1,0.0,1.0
1,Bidder Betty,45.0,50.0,Test bidding slightly below value for winning often with decent profits. Test consistently bidding a set amount like $50. Occasionally bid well over value to analyze risk versus reward. Observe competitors to adapt strategies for long-term profit maximization.,False,True,True,1,0.0,1.0
1,Bidder Charles,45.0,45.0,"Next, execute a more aggressive approach, bid closer to the full value to increase the chance of winning. Also, introduce a random bidding strategy in some rounds for diverse data.",False,False,True,1,0.0,1.0
2,Bidder Andy,3.0,3.0,"Planning to observe high value rounds, increase my bids proportionally while staying profitable. Experimenting with bids closer to value to assess risk-reward ratio. Monitoring patterns, avoiding past failed bids, and adapting strategy to competitors.",False,False,True,0,0.0,1.0
2,Bidder Betty,50.0,21.0,"Next, I'll test aggressive bidding, placing high bids regardless of value. I'll also continue to bid close to value for data gathering, adjusting according to previous rounds. Constant strategy will be set at $50 bid.",True,False,True,1,0.0,1.0
2,Bidder Charles,44.0,49.0,"For the next round, implement a randomized strategy to create data variation. Concurrently, adjust bid to about 90% of value to maximise winning chance while ensuring profitability. Monitor and adjust strategies based on competitors’ bidding patterns.",False,True,True,0,0.0,1.0
