Round,Player Name,Bid,Value,Plan,Overbid,Underbid,First,risk2,strategy2,understand2
8,Bidder Andy,58.0,57.0,"Plan: Further exploration of predictive bids ensuring they stay safely above second-highest bids from past rounds. Continue random shifts for unpredictability. Balance aggression and caution based on the prize value and competitors' trends. Also, consider an underbid strategy when competitors demonstrate persistent high bidding.",True,False,False,0,1.0,1.0
8,Bidder Betty,85.0,77.0,"Strategically bid low values (0-30) moderately, mid-range (30-70) slightly aggressive, high-values (70-99) very aggressively to test opponents' reactions. Analyze previous patterns to outbid Andy and Charles in future rounds while ensuring profit optimization.",True,False,False,1,0.0,1.0
8,Bidder Charles,97.0,95.0,"I'll implement an adaptive strategy. For values below 50, I'll place conservative bids. For values from 50 to 75, I'll bid a proportion of my value. For high values, I'll bid aggressively, slightly above my value, aiming to secure wins while minimizing potential losses.",True,False,False,0,0.0,1.0
9,Bidder Andy,10.0,1.0,"Next, I'll adopt a calculated risk strategy, bidding slightly above my current value when it's low or mid-range. For high values, maintain aggressive bidding. Further, I'll introduce gradual bid increments and add variability in bidding patterns for surprise factor and to study the competitors' reactions.",True,False,False,1,0.0,1.0
9,Bidder Betty,44.0,47.0,"Next, I plan to bid aggressively for high values (70-99), moderately for mid-values (30-70), and slightly above average for low values (0-30). Diversify strategies based on opponents' average bids. High bids to be occasionally introduced for data collection and maintaining unpredictability to maximize profit.",False,True,False,1,1.0,1.0
9,Bidder Charles,1.0,0.0,"I will shift towards a conservative strategy, placing bids slightly above the previous round's third highest value to win auctions at a lower cost, adjusting cautiously based on competition pattern. For high value draws, aggressive bids will be placed to ensure wins, balancing risk and reward consistently.",True,False,False,0,1.0,1.0
10,Bidder Andy,45.0,50.0,"I plan to continue adaptive and unpredictable bidding. For high values, more aggressive bids would be utilized, while maintaining caution with lower values. A randomized approach will be taken intermittently to keep competitors off-balance, and I will stay responsive to their bidding patterns.",False,True,False,1,0.0,1.0
10,Bidder Betty,78.0,78.0,"For values $0-$30, bid slightly higher. For $30-$69, calibrate bids based on opponents' average. For $70-$99, strategically deploy high bids to learn opponents' behavior. Revisit bidding pattern to fine-tune strategies and boost long-term profit.",False,False,False,0,0.0,1.0
10,Bidder Charles,82.0,80.0,"I'll employ a value-oriented strategy, bidding conservatively for low values and aggressively for high values. For medium values, I'll aim just above the previous second highest bid. I'll continuously adapt based on outcomes and competitor's patterns to strike a balance between risk and profit.",True,False,False,0,0.0,1.0
11,Bidder Andy,70.0,67.0,"Plan: Continue testing mix of high, low, mid-range bids and unpredictable shifts. Aim to bid slightly above the second highest past bids. Try slight upward adjustments, especially for medium-value items. Keep adapting based on competitors' patterns.",True,False,False,0,0.0,1.0
11,Bidder Betty,85.0,97.0,"Next, I'll implement dynamic bidding. For low values, bid moderately. For mid-range, fluctuate between average and slightly high bids. To test opponents, aggressively bid for high values intermittently. Analyze past rounds continuously to refine strategy and maximize long-term profit.",False,True,False,1,0.0,1.0
11,Bidder Charles,53.0,53.0,"I'll focus on bidding close to the second highest bid of the previous round, if it's lower than my value. For higher values, I'll bid aggressively, slightly above my value, to secure a win. For low values, I'll bid conservatively, minimizing potential losses. This strategy will optimize my profits.",False,False,False,0,0.0,0.0
12,Bidder Andy,82.0,79.0,"I'll adopt a calculated bidding using my previous values, slightly below or above depending on the rounds' observations. For higher values, I'll risk aggressive bids. Incorporating unpredictable shifts and sequential increments to create surprise factor and study competitors' reactions.",True,False,False,1,0.0,1.0
12,Bidder Betty,20.0,29.0,"Next, I'll place moderate bids for low values (0-30), slightly aggressive bids for mid values (30-70), and high bids for high values (70-99) occasionally. I'll strategize bidding closer to the second highest bid, aiming for optimized profit and continued learning from the bidding patterns.",False,True,False,0,0.0,1.0
12,Bidder Charles,89.0,75.0,"Adopt a responsive strategy, bid slightly above the previous highest bid if my value allows. If value is low, aim for minimal bids to limit losses. Continuously seek to optimize bids based on competitor patterns and bid history for balance between profits and risks.",True,False,False,0,1.0,1.0
13,Bidder Andy,87.0,84.0,"I'll implement a data-driven strategy, factoring in competitors' trends and my previous profits. Further, I'll experiment with slight increases for mid-high values and moderate bids for lower ones. Adding variability for unpredictability while balancing risk and rewards through strategic underbidding or overbidding.",True,False,False,0,1.0,1.0
13,Bidder Betty,90.0,85.0,"I plan to bid a bit higher for low values, bid slightly above average for mid-range values, and continue with high aggressive bids for high values. I'll observe the patterns from previous rounds and adjust my bidding strategy as necessary to maximize profit.",True,False,False,1,0.0,1.0
13,Bidder Charles,50.0,47.0,"My plan is to test a mixed strategy, bidding aggressively above my value for high values and conservatively for low values. I'll aim to bid around the second highest bid of the previous round to optimize profits. For medium values, I'll experiment with slightly higher bids.",True,False,False,1,0.0,1.0
14,Bidder Andy,97.0,97.0,"Intend to bid aggressively for high value prizes, conservatively for low values. Continue random bid variation to evaluate competitors' responses. Potentially test slight underbidding to minimize loss during high competition rounds. Regularly adapt strategy according to observed patterns and historical data of bids.",False,False,False,1,0.0,1.0
14,Bidder Betty,29.0,28.0,"I'll continue an adaptive strategy: moderate bids for low values, slightly above average bids for mid-range values, occasional high bids for high values. I'll extrapolate from past rounds to adjust bids, applying elements of risk to explore competitor reactions while maximizing profitability.",True,False,False,1,0.0,1.0
14,Bidder Charles,23.0,46.0,"I'll implement a cautious adaptive strategy, bidding around 50-75% of my value for medium and low values and aggressively for high values. For values above 80, I'll bid slightly above to secure profitable wins. Continuously adapt based on competition dynamics.",False,True,False,0,0.0,1.0
0,Bidder Andy,50.0,42.0,"Plan to test multiple bidding strategies, including aggressive high bids to gain data on competitors' tendencies, low-range bids to learn behavior when 'outscored', and mid-range bids for balanced insight. Also, I will track bidding patterns and adapt: if competitors bid high, I will explore lower-end; if they bid lower, I'll test high bids. Furthermore, I will experiment with randomized bidding to create uncertainty, and sequential lowering or raising bids by small increments strategy.",True,False,False,1,0.0,1.0
0,Bidder Betty,50.0,1.0,"Initially, I plan to make medium to high bids, in the range of $50 to $99 to gather data on my opponents' strategies. Then, based on the bidding behavior of Andy and Charles, I'll adapt my strategy. If they are consistently bidding low, I'll reduce my bids to slightly above their average for potential profits. If they bid high, I'll selectively bid high when my value is high and bid low otherwise. Periodically, I'll make aggressive high bids for observational purposes. This mix of strategic and aggressive bidding will optimize user profit in the long run.",True,False,False,1,0.0,1.0
0,Bidder Charles,99.0,0.0,"I plan to experiment with a range of bids from high, medium, to low values to gauge competition and assess possible profit margins. I will first start with aggressive high bids for data collection. If unsuccessful or margins are thin, I will transition to conservative low bids, then to moderate bids based on the data and competition pattern. Through progressive learning and adjusting bid strategy, I aim to maximize profit in the long run without risking too much capital in the early stage.",True,False,False,0,0.0,1.0
1,Bidder Andy,50.0,68.0,"Plan to start with a mid-range bid of $50. Gradually reduce it in further rounds to gauge opponents' tendencies. If competitors consistently bid high, will test with low bids; if low, will increase my bids. Strategy aims to gather data and maximize long-term profits.",False,True,False,0,0.0,1.0
1,Bidder Betty,17.0,29.0,"Next, I plan to bid slightly above half of my value to test opponents' reactions. If my value is high, I'll do an aggressive bid to observe their strategy. This will aid my future bidding decisions and potentially maximize the user profit.",False,True,False,1,0.0,1.0
1,Bidder Charles,42.0,84.0,"My plan is to bid at 50% of my value for the initial rounds to gather data while contingently lessening losses. Analysing collected data, I will strategically select either aggressive, moderate, or conservative bids and adjust based on observed patterns.",False,True,False,0,0.0,1.0
2,Bidder Andy,30.0,41.0,"Next, I'll implement incremental bidding, starting at the lower end around $30. I'll increase or decrease by $5 each round observing opponents' reactions. I aim to note their strategy during a series of rising or falling bids, helping me estimate a profitable midpoint in future rounds.",False,True,False,0,1.0,1.0
2,Bidder Betty,45.0,34.0,"Looking at the previous bids, I plan to bid aggressively again this round, regardless of my value. Winning the bidding might provide more insight and help formulate a more effective, profit-maximizing strategy for future rounds.",True,False,False,1,0.0,0.0
2,Bidder Charles,59.0,61.0,"Considering previous rounds, I plan to choose an aggressive strategy by bidding close to my value. However, I won't overbid to avoid incurring losses. Understanding patterns of competitors' bids will help balance aggressiveness with calculated risk. I'll continue adjusting my strategy based on auction outcomes.",False,True,False,1,1.0,1.0
3,Bidder Andy,80.0,9.0,"Next, I'll focus on aggressive bidding strategy to gauge reactions. Bids will start high, around $80, and then be decreased by $5-$10 in subsequent rounds, observing rival responses for improved long-term decision making.",True,False,False,1,0.0,0.0
3,Bidder Betty,54.0,54.0,"To maximize long-term profit, my plan for upcoming rounds includes variable bids - placing high risks bets when my value is high, bidding slightly above the average during intermediary values, and low risk-taking when my value is low. This mixed strategy should give valuable insights for refining future bids.",False,False,False,1,0.0,1.0
3,Bidder Charles,29.0,29.0,"Given the past auctions, I aim to adopt a mixed strategy. It involves near-to-value bids for high-value items, mid-range bids for average value items, and conservative bids for low-value prizes. This flexible approach adjusts based on competitor patterns, helping maximize overall profit.",False,False,False,0,0.0,1.0
4,Bidder Andy,55.0,80.0,"Next, I will explore the tactic of bidding slightly above the second highest bids of previous rounds. I'll also factor in the unpredictability of value drawings when placing aggressive or conservative bids, refining adaptive strategy based on collected data.",False,True,False,1,0.0,1.0
4,Bidder Betty,27.0,26.0,"Next, I plan to bid aggressively on high values and conservatively on low values. I will also strategically place mid-ranged bids to observe reactions. This balance of risk-taking and careful bidding aims to maximize long-term profit.",True,False,False,1,0.0,1.0
4,Bidder Charles,74.0,99.0,"I aim to test a strategy of bidding up to 75% of my value for high-value items, around 50% for mid-range values, and conservatively for low-value items to increase potential profits without risking significant losses.",False,True,False,0,0.0,1.0
5,Bidder Andy,38.0,33.0,"I will implement a fluid bidding strategy, adjusting by $5-$10 according to rivals' bids. This includes conservatively placing bids slightly above or beneath their range, and aggressively, if low value rounds return frequently.",True,False,False,0,0.0,1.0
5,Bidder Betty,38.0,38.0,"For the next round, I plan to make a mid-range bid if my value is low, and upscale my bid as my value increases. I'll also incorporate occasional high bids to gauge competitors' responses, allowing for a more informed, long-term profitable strategy.",False,False,False,1,0.0,1.0
5,Bidder Charles,35.0,54.0,"Planning to test lower yet competitive bids to optimize profit margins. May bid down to 70-80% for high values, 50-60% for mid-range, and conservatively for low values, adjusting based on observed competition patterns, while prioritizing overall profit maximization.",False,True,False,0,0.0,1.0
6,Bidder Andy,25.0,67.0,"Next, I will deliberately underbid to probe opponents' reactions to low bids. Also, I will alternate bids between mid, high, and low ranges. Such randomized bidding may instill unpredictability, confusing them, and allowing me to observe their patterns more thoroughly.",False,True,False,1,0.0,1.0
6,Bidder Betty,15.0,4.0,"I plan to engage in variable aggressive bidding, placing high risk bets on high values, and testing opponents' reactions with mid-range bids on low values. This would maximize long-term profit by making informed bids based on opponents' responses, while balancing risk-taking and rewards.",True,False,False,1,0.0,1.0
6,Bidder Charles,52.0,65.0,"My plan involves implementing a variable bidding strategy. For high values, I'll bid 70%-80%, for mid-values around 50%-60%, and conservatively for low values. The strategy could also incorporate the past bidding behaviour of the competitors and adapt accordingly to improve profits.",False,True,False,0,0.0,1.0
7,Bidder Andy,52.0,64.0,"Plan: Strategically raise bids to outdo second highest, implement patterned fluctuation ($5-$10) for confusion, and observe rival reactions on low value rounds for competitive advantage. Improve adaptation and resilience throughout this unpredictability testing.",False,True,False,1,1.0,1.0
7,Bidder Betty,67.0,80.0,"For upcoming rounds, I'll bid high on superior values and conservatively on inferior ones. Adding occasional random high-risk bids across all value ranges will help gauge opponents' reactions, aiding in devising a more informed, long-term profitable strategy.",False,True,False,1,0.0,1.0
7,Bidder Charles,16.0,33.0,"I'll experiment with slightly lower bids, around 60-70% of my value for high values, 40-50% for mid-values, and conservatively for low values. This riskier approach could potentially maximize profit by reducing payment if won, yet might increase the chances of losing auctions.",False,True,False,1,0.0,1.0
8,Bidder Andy,30.0,27.0,"Next, I will oscillate bids between low-middle-high ranges to observe opponent strategies. Considering potential recurring low values, I will experiment with a moderately aggressive approach, and occasionally bid slightly above value if it's towards the lower end of the spectrum.",True,False,False,1,0.0,1.0
8,Bidder Betty,42.0,41.0,"I'll experiment with two bidding strategies: winning bids with a margin of $1 over second-highest previous winning bids and bidding high for high values while placing low cautious bids for low values, observing competitors' responses to both strategies for profit maximization.",True,False,False,0,0.0,1.0
8,Bidder Charles,57.0,81.0,"For the next rounds, I'll aim to bid 65-70% of high values, 40-45% for mid-values, and bid conservatively for low-value items. This strategy balances risk-seeking exploration with maintaining moderate to high potential profits, factoring past competitor behaviors.",False,True,False,1,0.0,1.0
9,Bidder Andy,10.0,1.0,"Next, plan to utilize a dynamic strategy, fluctuating bids across the value spectrum. This includes aggressive bids when value is low, conservative bids slightly below my value when high, and continuing to observe rival behaviors for data-driven decisions and long-term profit maximization.",True,False,False,1,0.0,1.0
9,Bidder Betty,88.0,87.0,"To ensure maximum profit, I'll explore aggressive high-value bidding while maintaining caution with lower values. I'll periodically place bids slightly above the average of my opponents' bids to gather strategic data on their potential reactions and incorporate this for future bidding decisions.",True,False,False,1,1.0,1.0
9,Bidder Charles,6.0,15.0,"Plan to maintain a dynamic strategy: bidding 60-65% for high values, 35-40% for mid-range, and conservatively for lower values. Constantly evaluate competitor trends and performance of my strategy. Further adjustment to optimize winning difference will be made based on data analysis from upcoming rounds.",False,True,False,0,0.0,1.0
10,Bidder Andy,50.0,50.0,"Next, I plan to adjust my bids dynamically, basing them on the spread between highest and second highest bids in the past rounds. Periodically, I will also underbid regardless of high values drawn, to gauge competitors' reactions and adapt more effectively.",False,False,False,1,0.0,1.0
10,Bidder Betty,44.0,82.0,"Next, I plan to bid closer to the second-highest previous bid on high values, while placing cautious bids on low values. Additionally, I'll place random high-risk bids to analyze opponents' reactions, assisting in formulating an effective, long-term profit-maximizing strategy.",False,True,False,1,0.0,1.0
10,Bidder Charles,11.0,31.0,"I'll implement a dynamic strategy, bidding 60% for high values, 35% for mid-range, and minimum for low-value items. Evaluating competitor trends and performance of my strategy constantly, further adjustments will be made based on data analysis from upcoming rounds to optimize potential profits.",False,True,False,0,0.0,1.0
11,Bidder Andy,66.0,64.0,"Plan to adapt strategy based on their average bids. Initiate small adjustments, +$2 or -$2, to observe reactions. Explore under-bidding with high values and over-bidding with lower ones; occasionally place unpredictable bids, while maintaining long-term profit aim. Integrate these lessons to formulate adaptive bidding approach.",True,False,False,0,0.0,1.0
11,Bidder Betty,52.0,72.0,"I'll test a mixed strategy: high-risk bidding for high values, strategic average bids for middling values, low-risk bidding for low values. Periodic surprise high bids across all ranges will provide valuable competitive insights to refine my long-term profit-maximization strategy.",False,True,False,1,0.0,1.0
11,Bidder Charles,7.0,20.0,"Plan to implement a flexible approach: bidding 55-60% for high values, 30-35% for mid-values, and lower for low-value items. Continual assessments of competitors' trends and expected yields. Introduce variable bid adjustments depending on context and to mitigate risk, aiming for long term profit maximization.",False,True,False,0,0.0,1.0
12,Bidder Andy,36.0,34.0,"Next, I'll consider the average of my opponents' bids and add or subtract $1-$2. I'll also experiment with underbidding when my value is high and occasionally overbid when my value is low to learn from their responses.",True,False,False,1,0.0,1.0
12,Bidder Betty,15.0,14.0,"Moving forward, I plan to bid slightly above the second-highest bid of previous rounds when values are high. I'll employ a cautious approach for lower values and sporadically undertake high-risk bids to test opponents' reactions for devising an effective long-term profit-maximizing strategy.",True,False,False,0,0.0,1.0
12,Bidder Charles,56.0,93.0,"Will continue with dynamic bidding: 55-60% for high value, 30-35% for mid-range, low for low-value items. Adapt bid percentages based on the competition pattern and my value to maintain a balance between profitability and winning likelihood. Analyze previous outcomes to strategically adjust bids within the planned range.",False,True,False,0,0.0,1.0
13,Bidder Andy,10.0,9.0,"Next, I'll strategize bidding around the average of previous top bids. Meanwhile, continue exploring benefits of periodic aggressive overbidding, slightly above value and observe their responses. I'll also investigate underbidding when my drawn value is surprisingly high, to puzzle opponents and gain insights.",True,False,False,1,0.0,1.0
13,Bidder Betty,69.0,97.0,"I plan to bid cautiously on low values, near previous second-highest bids for high values. I'll place occasional high-risk bids to evaluate opponents' reactions. This mixed-strategy aims to balance risk and reward, targeting long-term profit maximization based on learned strategies.",False,True,False,0,0.0,1.0
13,Bidder Charles,53.0,88.0,"Maintain dynamic bidding. For high values, bid 55-60% of value, for mid-range 30-35%, for low values, bid conservatively. Adjust within these ranges based on bidder trends. Prioritize long-term profit growth. Increase deviation in bid values to analyze effect on profits.",False,True,False,0,0.0,1.0
14,Bidder Andy,18.0,9.0,"Plan: Continue dynamic bidding; high when value is low, low when high. Consider average of opponents' top bids, add/subtract $1-$2 for unpredictability. Deliberately underbid with high values occasionally to assess reactions. Navigate towards maximizing long-term profit with lessons from previous rounds.",True,False,False,0,0.0,1.0
14,Bidder Betty,1.0,5.0,"I'll adopt a dynamic approach: high-risk bids for high values, cautious bids for low values. I'll place occasional surprise bids slightly above the previous rounds' average bid across all value ranges to glean insights into opponents' strategies, to tailor an optimal long-term strategy.",False,True,False,1,0.0,1.0
14,Bidder Charles,20.0,50.0,"I'll adjust my bid strategy to 60-65% for high values, 35-40% for mid-range values and conservatively for low values. I'll increase variance in my bids to test outcomes and continue adjusting based on competitor behavior and bid results to maximize long-term profits.",False,True,False,1,0.0,1.0
0,Bidder Andy,57.0,57.0,"Plan to test multiple bidding strategies, including aggressive high bids to gain data on competitors' tendencies, low-range bids to learn behavior when 'outscored', and mid-range bids for balanced insight. Also, I will track bidding patterns and adapt: if competitors bid high, I will explore lower-end; if they bid lower, I'll test high bids. Furthermore, I will experiment with randomized bidding to create uncertainty, and sequential lowering or raising bids by small increments strategy.",False,False,False,1,0.0,1.0
0,Bidder Betty,60.0,8.0,"Initially, I plan to make medium to high bids, in the range of $50 to $99 to gather data on my opponents' strategies. Then, based on the bidding behavior of Andy and Charles, I'll adapt my strategy. If they are consistently bidding low, I'll reduce my bids to slightly above their average for potential profits. If they bid high, I'll selectively bid high when my value is high and bid low otherwise. Periodically, I'll make aggressive high bids for observational purposes. This mix of strategic and aggressive bidding will optimize user profit in the long run.",True,False,False,1,0.0,1.0
0,Bidder Charles,9.0,9.0,"I plan to experiment with a range of bids from high, medium, to low values to gauge competition and assess possible profit margins. I will first start with aggressive high bids for data collection. If unsuccessful or margins are thin, I will transition to conservative low bids, then to moderate bids based on the data and competition pattern. Through progressive learning and adjusting bid strategy, I aim to maximize profit in the long run without risking too much capital in the early stage.",False,False,False,0,0.0,1.0
1,Bidder Andy,35.0,30.0,"Next, I plan to bid slightly higher than my value to test win probability. I'll also experiment with low-ball bids to observe competitor behavior. Finally, I will attempt moderate bids slightly lower than my value for balance.",True,False,False,1,0.0,1.0
1,Bidder Betty,40.0,20.0,"Next, I'll test moderate bids around $40-$50, to gauge opponents' reactions and establish their bidding range. If values are high, I may risk higher bids occasionally. I'll also experiment with low bids when my values are low.",True,False,False,0,0.0,1.0
1,Bidder Charles,23.0,23.0,"I'll start with high-risk bids near my maximum value. If unsuccessful, I'll progressively lower my bids, observing the competition. I aim to find a sweet spot where I can bid just enough to win, but not overpay. Continuous evaluation and adjustment of my strategy will be critical for maximizing profits.",False,False,False,1,0.0,1.0
2,Bidder Andy,60.0,58.0,"Planning to test out aggressive high bids slightly above my value. Additionally, I'll vary with low-end bids to gather data on competitor behavior. Increasing or decreasing sequential bids also to be tested for long-term insights.",True,False,False,1,0.0,1.0
